Product Name,Quantity,Retail Price,Received,Profit,Amazon Link,Ebay Link
"Bingfu Universal Car Stereo FM Radio Antenna Signal Booster Amplifier Amp,12V Power Supply DIN Plug Connector Adapter for Vehicle Truck SUV Car Audio Radio Stereo Media Head Unit Receiver",1,11.68,15.4,1.41,https://www.amazon.com/dp/B07N8LRTT5?tag=dcaft-20,https://www.ebay.com/itm/296211431800
PAWFUME Premium Grooming Spray Dog Spray Deodorizer Perfume For Dogs - Dog Cologne Spray Long Lasting Dog Sprays - Dog Perfume Spray Long Lasting After Bath- Dog deodorizing Spray (Lavender),1,11.8,15.94,1.75,https://www.amazon.com/Pawfume-Premium-Grooming-Spray-Dog-Spray-Deodorizer-Perfume-For-Dogs-Dog-Colog/dp/B083M91JDB?tag=dcaft-20,https://www.ebay.com/itm/335088339782
"It's Just - Baking Soda, 100% Pure Sodium Bicarbonate, Food Grade, Non-GMO, Made in USA, Cooking, Baking, Aluminum Free (1.25 Pound)",1,9.46,13.73,2.21,https://www.amazon.com/Its-Just-Baking-Soda-100-Pure-Sodium-Bicarbonate-Food-Grade-Non-Gmo-Made/dp/B07RX943Y8?tag=dcaft-20,https://www.ebay.com/itm/334870633631
Dog Birthday Bandana - Girl Dog Birthday Hat with Number - Dog Birthday Supplies for Small Medium Dog Pet (Pink),2,15.14,22.8,4.24,https://www.amazon.com/Dog-Birthday-Bandana-Girl-Dog-Birthday-Hat-With-Number-Dog-Birthday-Supplies/dp/B09HBVK7QH?tag=dcaft-20,https://www.ebay.com/itm/355266877841
Stanbroil 62-23543-01 Flame Sensor Igniter Sensing Rod Fit for Rheem Furnace (1 Pack),1,6.99,10.1,1.6,https://www.amazon.com/Stanbroil-62-23543-01-Flame-Sensor-Igniter-Sensing-Rod-Fit-For-Rheem-Furnace-1/dp/B08NJNS93W?tag=dcaft-20,https://www.ebay.com/itm/355087727210
"Cream of Rice Gluten Free Hot Cereal, 14 Ounce",1,3.99,6.64,1.65,https://www.amazon.com/Cream-Of-Rice-Gluten-Free-Hot-Cereal-14-Ounce/dp/B000WHXORC?tag=dcaft-20,https://www.ebay.com/itm/355405995083
Universal Pot Lid Replacement Knobs Pan Lid Holding Handles for rival Crockpot Replacement Lid parts Handle(1 Pack),1,5.48,7.7,1.07,https://www.amazon.com/Universal-Pot-Lid-Replacement-Knobs-Pan-Lid-Holding-Handles-For-Rival-Crockpot-R/dp/B0BJ2FBNN6?tag=dcaft-20,https://www.ebay.com/itm/354995783962
"PEDIGREE Small Dog Complete Nutrition Small Breed Adult Dry Dog Food Roasted Chicken, Rice & Vegetable Flavor Dog Kibble, 3.5 Pound (Pack of 1)",1,5.67,8.09,1.21,https://www.amazon.com/dp/B007ZZDJWY?tag=dcaft-20,https://www.ebay.com/itm/404247405083
"Alpecin C1 Caffeine Shampoo, 8.45 fl oz (Pack of 3)",1,27.55,35.68,2.78,https://www.amazon.com/Alpecin-C1-Caffeine-Shampoo-845-Fl-Oz-Pack-Of-3/dp/B01FWC755S?tag=dcaft-20,https://www.ebay.com/itm/225933047399
"Dr. Berg's Vitamin D3 K2 Supplement w/MCT Oil - Includes 10,000 IU of Vitamin D3, 100 mcg MK7 Vitamin K2, Purified Bile Salts, Zinc & Magnesium for Ultimate Absorption - 120 Capsule",1,38.93,67.75,18.66,https://www.amazon.com/Dr-Bergs-Vitamin-D3-K2-Supplement-Wmct-Oil-Includes-10000-Iu-Of-Vitamin-D3/dp/B06WRNG37C?tag=dcaft-20,https://www.ebay.com/itm/185765009823
"PILOT Precise V5 RT Refillable & Retractable Liquid Ink Rolling Ball Pens, Extra Fine Point (0.5mm) Black Ink, 2-Pack (26050)",1,3.59,5.52,1.1,https://www.amazon.com/Pilot-Precise-V5-Rt-Refillable-Retractable-Liquid-Ink-Rolling-Ball-Pens-Extra/dp/B001BQADT0?tag=dcaft-20,https://www.ebay.com/itm/354976500912
"Masterbuilt Electric Smoker Cookbook: 150 Fast, Easy and Delicious Recipes for Your Whole Family and Get-together with 1000-Day Meal plan",1,6.88,11.26,2.69,https://www.amazon.com/Masterbuilt-Electric-Smoker-Cookbook-150-Fast-Easy-And-Delicious-Recipes-For-Y/dp/169105738X?tag=dcaft-20,https://www.ebay.com/itm/335204859220
"12 Pack Basswood Sheets for Crafts-12 x 12 x 1/8 Inch- 3mm Thick Plywood Sheets with Smooth Surface-Unfinished Craft Wood Boards for Laser Engraving and Cutting, Architectural Models, Staining",1,18.35,22.99,1.19,https://www.amazon.com/dp/B0C7VCYWXF?tag=dcaft-20,https://www.ebay.com/itm/315076521567
"Pentel® Quicker Clicker™ Eraser Refills, Pack Of 15",1,4.56,6.49,0.96,https://www.amazon.com/Pentel%C2%AE-Quicker-ClickerTM-Eraser-Refills/dp/B00006IFB5?tag=dcaft-20,https://www.ebay.com/itm/225975258778
Meguiar's M100 Mirror Glaze Pro Speed Compound - 32 Oz Bottle,1,27.87,34.82,1.73,https://www.amazon.com/Meguiars-M10032-Mirror-Glaze-Compound/dp/B00AIYU148?tag=dcaft-20,https://www.ebay.com/itm/145608851573
DaierTek Horn Button 12V Marine Horn Button 16MM Momentary Push Button Switch Stainless Steel Blue LED Lighted Speaker Horn Switch for Car Auto Marine Boat,1,8.61,11.52,1.18,https://www.amazon.com/Daiertek-Horn-Button-12V-Marine-Horn-Button-16Mm-Momentary-Push-Button-Switch-St/dp/B0B9328PLX?tag=dcaft-20,https://www.ebay.com/itm/295906860931
"Bondo Red Cream Hardener, 00928, 2.75 oz",1,9.04,13.99,2.85,https://www.amazon.com/dp/B000CITG7S?tag=dcaft-20,https://www.ebay.com/itm/386691869657
"Rust-Oleum 248929 High Performance Wheel Spray Paint, 11 oz, Clear",2,16.68,22.16,2.16,https://www.amazon.com/Rust-Oleum-248929-High-Performance-Wheel-Spray-Paint-11-Oz-Clear/dp/B003CT4ARA?tag=dcaft-20,https://www.ebay.com/itm/315109876951
Titan 15611 1/2-Inch Drive x 11mm Hex Bit Socket,1,4.15,7.92,2.58,https://www.amazon.com/Titan-15611-12-Inch-Drive-X-11Mm-Hex-Bit-Socket/dp/B004W80ESO?tag=dcaft-20,https://www.ebay.com/itm/295959408077
Zoyuzan Lightning Male to USB Female Adapter OTG Cable for Apple iPhone 11 12 Mini Max Pro XS XR SE2 7 8plus Ipad Air3 A Camera Memory Card Connector,1,6.35,12.63,4.39,https://www.amazon.com/Zoyuzan-Lightning-Male-To-Usb-Female-Adapter-Otg-Cable-For-Apple-Iphone-11-12-Mi/dp/B08V55QBFN?tag=dcaft-20,https://www.ebay.com/itm/155511229296
"SUNEX TOOLS 97329A 1/2"" Drive 29 mm Fully Polished Jumbo Straight Crowfoot Wrench",1,10.6,13.74,1.08,https://www.amazon.com/Sunex-97324A-12-Inch-Drive-24-Mm-Jumbo-Crowfoot-Wrench/dp/B00SI7FMI2?tag=dcaft-20,https://www.ebay.com/itm/395172771847
"MoKo 400x300mm DIY PC Case Dust Mesh Filter, [2 Pack] PVC Dustproof Magnetic Dust Filter Cover, PC Mesh Grill with Magnetic Frame Strip Computer Cooler Fan Dust Filter for Computer PC Case, Black",1,10.79,13.93,1.05,https://www.amazon.com/dp/B0BHSS55RM?tag=dcaft-20,https://www.ebay.com/itm/315039273764
"Pellon 987F Fusible Fleece 22"" (Bolt, 7 yards), Fabric by the Bolt",1,33.06,40.9,1.71,https://www.amazon.com/Pellon-987F-Fusible-Fleece-22-Bolt-7-Yards-Fabric-By-The-Bolt/dp/B07L3BQPLZ?tag=dcaft-20,https://www.ebay.com/itm/355466771276
"Oral-B Super Floss Pre-Cut Strands Dental Floss, Mint, 50 Count",1,4.29,6.3,1.07,https://www.amazon.com/Oral-B-Super-Floss-Pre-Cut-Strands-Dental-Floss-Mint-50-Count/dp/B0000530R6?tag=dcaft-20,https://www.ebay.com/itm/355454315165
"TSG Universal Auto Care Silicone Paste with Brush, 8 oz",1,15.07,18.88,0.98,https://www.amazon.com/Tribologytech-Lube-Tsg-Universal-Auto-Care-Silicone-Paste-With-Brush-8-Oz/dp/B077PD43P8?tag=dcaft-20,https://www.ebay.com/itm/395183144469
Jesus Revolution [DVD],1,7.97,10.88,1.28,https://www.amazon.com/Jesus-Revolution-Dvd/dp/B0BV7BTFXX?tag=dcaft-20,https://www.ebay.com/itm/296090727629
"BigOtters 170pcs Bulk Mosaic Tiles, 140g Colors Glass Pieces Assorted Color Opaque Mosaic Glass for DIY Picture Home Mosaic Decoration (Blue Series)",2,12.7,19.2,3.62,https://www.amazon.com/dp/B09J3PVKLN?tag=dcaft-20,https://www.ebay.com/itm/225919647775
"16 Pcs Ski Brake Retainers Snowboard Binding Rubber Bands Ski Tuning Accessory for Winter Outdoor Sports, Blue",1,7.72,10.25,0.99,https://www.amazon.com/Bbto-16-Pcs-Ski-Brake-Retainers-Snowboard-Rubber-Retainers-Snowboard-Brake-Bands/dp/B0CGKJJPML?tag=dcaft-20,https://www.ebay.com/itm/355277950933
"Cultures for Health San Francisco Sourdough Style Starter Culture | Homemade Artisan Bread | Heirloom, non-GMO | Live Culture Bread Mix | Easy to Follow Recipe",1,13.99,18.22,1.5,https://www.amazon.com/Cultures-For-Health-San-Francisco-Sourdough-Style-Starter-Culture-Homemade-Art/dp/B00YVE3076?tag=dcaft-20,https://www.ebay.com/itm/314620620263
"PAGOW 2 Pack Proportioning Valve Bleeder Tool, PV2 PV4 Disc/Drum Brake Proportioning Valve Bleeder Tool, for AC Delco 172-1353 172-1371 with GMs Street Rod Classic Car and Chevys Truck, Blue",1,11.76,15.28,1.23,https://www.amazon.com/Pagow-2-Pack-Proportioning-Valve-Bleeder-Tool-Pv2-Pv4-Discdrum-Brake-Proportio/dp/B08SJX8Y3F?tag=dcaft-20,https://www.ebay.com/itm/155838206036
"CleanTools The Absorber Synthetic Premium Drying Chamois Cloth for Car: Super Absorbent, Scratch-Free and Washable | 27-Inch x 17-Inch, Blue, Large (PN: 14942-42149)",1,14.59,21.82,3.96,https://www.amazon.com/Cleantools-42149-The-Absorber-Synthetic-Drying-Chamois-27-X-17-Blue/dp/B09ZK7G449?tag=dcaft-20,https://www.ebay.com/itm/404797249795
TIMMKOO Mp3 Player Case Cover for Q3E and Q5,1,10.59,14.6,1.82,https://www.amazon.com/TIMMKOO-Mp3-Player-Case-Cover/dp/B0BF52FNMP?tag=dcaft-20,https://www.ebay.com/itm/355449005293
AUVON TENS Unit Pads Electrode Patches with Upgraded Self-Stick Performance and Non-Irritating Design for Electrotherapy,1,9.62,15.99,3.97,https://www.amazon.com/Auvon-Tens-Unit-Pads-Electrode-Patches-With-Upgraded-Self-Stick-Performance-And/dp/B071WRQ9YH?tag=dcaft-20,https://www.ebay.com/itm/395185547427
"Spirit Hunter 99.9% Copper Dowsing Rod- 2PCS Divining Rods with Bag - Detect Gold, Water, Ghost Hunting etc.",2,32.3,41.04,2.58,https://www.amazon.com/dp/B08BKKQRV2?tag=dcaft-20,https://www.ebay.com/itm/315148457656
"HealthSmart Pill Crusher and Grinder, Crushes Vitamins and Tablets, Holds Up to 2 Pills, With Ergonomic Grips, Red",1,3.05,4.71,0.95,https://www.amazon.com/Healthsmart-Pill-Crusher-And-Grinder-Crushes-Vitamins-And-Tablets-Holds-Up-To/dp/B00AXXFC7A?tag=dcaft-20,https://www.ebay.com/itm/355224616158
45-69-0010 Blade Pulley Tire Replacement for Milwaukee Band Saws Deep Cut 6230 6232-6 6225 6232 6227-2 Pack,1,10.81,13.93,1.03,https://www.amazon.com/45-69-0010-Blade-Pulley-Tire-Replacement-For-Milwaukee-Band-Saws-Deep-Cut-6230-6/dp/B0953GFMSB?tag=dcaft-20,https://www.ebay.com/itm/315078714475
Windshield Washer Nozzle Jet Hose Kit for 2011-2016 Ford F250 F350 F450 F550 Super Duty Replace BC3Z-17603-A BC3Z-17K605-B,1,13.8,18.58,1.99,https://www.amazon.com/Windshield-Washer-Nozzle-Jet-Hose-Kit-For-2011-2016-Ford-F250-F350-F450-F550-Sup/dp/B09JS7R344?tag=dcaft-20,https://www.ebay.com/itm/285686157929
"CHI-CHI’S Thick and Chunky Salsa Medium, 60 ounce",1,7.12,11.35,2.53,https://www.amazon.com/Chi-Chis-Medium-Thick-Chunky-Salsa/dp/B00E9RUZUU?tag=dcaft-20,https://www.ebay.com/itm/175705790290
"Car Cellular Phone Signal Booster & Repeater Antenna 5G, 4G LTE for Verizon At&t Sprint T-Mobile Phones by Cellet",1,15.74,20.4,1.6,https://www.amazon.com/Strength-Booster-Repeater-Antenna-Verizon/dp/B015E0ACLM?tag=dcaft-20,https://www.ebay.com/itm/315076535237
"82 Pieces 5 Styles Shelf Pegs Kit, Bookcase Shelf Pegs, Kindroufly Metal Shelf Pegs, Adjustable Shelf Pins, Cabinet Pins for Shelves, Cabinets, Wood Shelving",1,9.77,13.42,1.64,https://www.amazon.com/82-Pieces-5-Styles-Shelf-Pegs-Kit-Bookcase-Shelf-Pegs-Kindroufly-Metal-Shelf-P/dp/B09YDQXVGS?tag=dcaft-20,https://www.ebay.com/itm/296130864653
"ZEYAR Acrylic Paint Marker Pens, Extra Fine Point, Nylon Tip, 12 colors, Water based, Expert of rock painting, Water and Fade Resistant, Non-toxic",1,12.07,17.95,3.19,https://www.amazon.com/ZEYAR-Resistant-Non-Toxic-Professional-Manufacturer/dp/B07C4KY5XX?tag=dcaft-20,https://www.ebay.com/itm/186148099550
"RG58A/U PL-259 Coax Cable Jumper for HAM & CB Radio, Antenna Analyzer, Dummy Load, SWR Meter, 3 Foot",1,8.99,13.16,2.2,https://www.amazon.com/Versainsect-Cable-Jumper-For-Ham-Cb-Radio-Antenna-Analyzer-Dummy-Load-Swr-M/dp/B08HBY2FJK?tag=dcaft-20,https://www.ebay.com/itm/386609897068
"HBGD E17 LED T7 T8 Medium Base LED Appliance Bulb, Dimmable, 4W (Equivalent to 40W Halogen Bulb), Daylight White 6000K 110V-130V, Ceramic E17 LED Bulb for Microwave and Oven Appliances Pack of 2",1,9.53,12.81,1.36,https://www.amazon.com/dp/B074MCZW85?tag=dcaft-20,https://www.ebay.com/itm/315157788370
2017 National Electrical Code NEC Softcover Tabs,1,10.95,16.95,3.46,https://www.amazon.com/2017-National-Electrical-Code-Nec-Softcover-Tabs/dp/1622701356?tag=dcaft-20,https://www.ebay.com/itm/395206272052
50 Piece Flush Mount Black Hole Plug Assortment for Auto Body and Sheet Metal,1,11.99,16.52,2.05,https://www.amazon.com/50-Piece-Flush-Mount-Black-Hole-Plug-Assortment-For-Auto-Body-And-Sheet-Metal/dp/B00PP7XU1E?tag=dcaft-20,https://www.ebay.com/itm/176194920954
"Rust-Oleum 7798830 Stops Rust Spray Paint, 12 oz, Semi-Gloss Black",1,7.4,10.21,1.28,https://www.amazon.com/Rust-Oleum-7798830-Stops-Rust-Spray-Paint-12-Oz-Semi-Gloss-Black/dp/B0009X8LPE?tag=dcaft-20,https://www.ebay.com/itm/134823024084
"Hartz DuraPlay Bacon Scented Dog Toys, Small (Assorted Color)",1,3.79,5.83,1.17,https://www.amazon.com/Hartz-Dura-Play-Bacon-Scented-Squeak-Ball-Dog-Toy-Multiple-Dog-Toy-Sizes-Pack/dp/B0006L2OKW?tag=dcaft-20,https://www.ebay.com/itm/404626047944
Work Sharp Knife & Tool Sharpener 6000 Grit Fine Replacement Belt Kit WSSA0002705,1,13.89,17.99,1.4,https://www.amazon.com/Work-Sharp-Knife-Tool-Sharpener-6000-Grit-Fine-Replacement-Belt-Kit-Wssa000270/dp/B008BX95DG?tag=dcaft-20,https://www.ebay.com/itm/395191884119
RICHERI 40Pcs Electric Motor Carbon Brushes 10 Different Sizes for Replacement Repair Power Tool Part,1,9.99,14.99,2.75,https://www.amazon.com/dp/B0C6GJSKJ5?tag=dcaft-20,https://www.ebay.com/itm/225902665651
"haraqi Himalayan Salt Lamp Cord and Bulb with Dimmer Switch,Original Replacement Cord Bulb for Salt Rock Lamps,UL Certified Cord 6 ft",3,27.33,39.6,6.33,https://www.amazon.com/Himalayan-Original-Replacement-Certified-Foots-1-5/dp/B071KZKYCB?tag=dcaft-20,https://www.ebay.com/itm/144986555428
"PUR Gum | Aspartame Free Chewing Gum | 100% Xylitol | Sugar Free, Vegan, Gluten Free & Keto Friendly | Natural Chocolate Mint Flavored Gum, 55 Pieces (Pack of 1)",1,4.49,9.33,3.44,https://www.amazon.com/Pur-Gum-Aspartame-Free-Chewing-Gum-100-Xylitol-Sugar-Free-Vegan-Gluten/dp/B01CU5ZJP8?tag=dcaft-20,https://www.ebay.com/itm/296108729254
"yuntop 1Pcs 23In Flexible Plastic Drawstring Threader Tool, Easy Threader Drawstring Replacement Tool for Jackets Swim Trunks Pants Sweatpants Shorts Hoodies (Blue)",1,4.23,6.34,1.16,https://www.amazon.com/dp/B091CL54L7?tag=dcaft-20,https://www.ebay.com/itm/355228157265
Aromasong Lavender Pillow Spray - All Natural Calming Linen & Bedtime Mist for Deep Sleep - Aromatherapy Botanical Essential Oils for Sleeping - for Relaxing Stress Fragrance Scent,1,9.49,12.81,1.4,https://www.amazon.com/dp/B093LPTTB9?tag=dcaft-20,https://www.ebay.com/itm/145516259690
Mitsubishi Pencil with Pencil Eraser 9850 Hardness HB K9850HB by B. Toys,1,8.77,12.45,1.81,https://www.amazon.com/Mitsubishi-Pencil-Pencil-With-Pencil-Eraser-9850-Hardness-Hb-K9850Hb-Original-V/dp/B001BKZVWU?tag=dcaft-20,https://www.ebay.com/itm/145567328473
"EZ-FLO 7 x 9 Inch White Bathroom Shower Splash Guard, Pack of 2, 15261",1,3.02,4.93,1.17,https://www.amazon.com/Ez-Flo-7-X-9-Inch-White-Bathroom-Shower-Splash-Guard-Pack-Of-2-15261/dp/B00065IZ6A?tag=dcaft-20,https://www.ebay.com/itm/395207830795
TUSITA Charger Compatible with Wahoo TICKR FIT - 1M,1,9.9,14.99,2.84,https://www.amazon.com/Tusita-Charger-Compatible-With-Wahoo-Tickr-Fit-1M/dp/B0CDCNKCXK?tag=dcaft-20,https://www.ebay.com/itm/225983416388
IPELY 7 Pcs 3 Inch Wool Polisher Buffing Wheel Small Buffing Pads for Drill Buffer Attachment with M10 Drill Adapter,1,10.74,14.1,1.25,https://www.amazon.com/dp/B0BXSFMFG9?tag=dcaft-20,https://www.ebay.com/itm/314998177804
"Rust-Oleum 314560 Universal All Surface Metallic Spray Paint, 11 oz, Satin Bronze",1,12.41,16.05,1.23,https://www.amazon.com/Rust-Oleum-314560-Universal-All-Surface-Metallic-Spray-Paint-11-Oz-Satin-Bronz/dp/B000LEL1JY?tag=dcaft-20,https://www.ebay.com/itm/395025397405
2 Pack Universal Pot Lid Handle Replacement Compatible With rival crockpot Replacement Lid Parts and more Universal Kitchen Cookware Lid Replacement Knobs 2.5 Inch,1,6.35,8.7,1.05,https://www.amazon.com/dp/B0BVRB13YM?tag=dcaft-20,https://www.ebay.com/itm/355373116352
"Mule, The (DVD)",1,5.39,7.63,1.1,https://www.amazon.com/Mule-The-Dvd/dp/B07KZGS6J9?tag=dcaft-20,https://www.ebay.com/itm/355406567583
Washburn Dad's Wrapped Root Beer Barrels ~ 2 Lbs ~ Old Fashioned Flavor,1,11.97,20.47,5.43,https://www.amazon.com/Washburn-Dads-Wrapped-Root-Beer-Barrels-2-Lbs-Old-Fashioned-Flavor/dp/B008EM05GU?tag=dcaft-20,https://www.ebay.com/itm/145433692231
"Upgraded Version 6 Pack Reflective Cat Collars with Bell,Breakaway Safety Kitten Collar,Adjustable 7''-12'',for Girl Boy Cats,Pet Supplies,Stuff,Accessories",1,5.32,8.2,1.65,https://www.amazon.com/Upgraded-Reflective-Breakaway-Adjustable-Accessories/dp/B0C1BVC8QD?tag=dcaft-20,https://www.ebay.com/itm/315161713506
"Blackjack Basic Strategy Chart: 4/6/8 Decks, Dealer Hits Soft 17",1,3.17,4.94,1.03,https://www.amazon.com/Blackjack-Basic-Strategy-Chart-468-Decks-Dealer-Hits-Soft-17-Cards-October/dp/0982119151?tag=dcaft-20,https://www.ebay.com/itm/355144540283
"Polarized 2-Prong L Type Adapter, Vertical Right Angled Down Angle AC Adapter, NEMA 1-15P USA Outlet Saver Extension Adapter High Heat Resistant 2Pin Adapter",1,7.36,10.1,1.23,https://www.amazon.com/dp/B096S9TL6N?tag=dcaft-20,https://www.ebay.com/itm/355398657722
Herbs for Common Ailments: How to Make and Use Herbal Remedies for Home Health Care. A Storey BASICS® Title,1,7.21,10.2,1.46,https://www.amazon.com/dp/1612124313?tag=dcaft-20,https://www.ebay.com/itm/296102978347
"Rust-Oleum 7515838 Professional High Performance Enamel Spray Paint, 14 Oz, Aluminum",3,32.31,42.27,3.63,https://www.amazon.com/Rust-Oleum-7515838-Professional-High-Performance-Enamel-Spray-Paint-14-Oz-Alum/dp/B000ZYNDTG?tag=dcaft-20,https://www.ebay.com/itm/134828573697
"OEMTOOLS 25254 Oil Pressure Switch Socket, 1/2 Drive | Fits 1 Inch and 1-1/16 Inch Oil Pressure Switches | Accepts Oil Pressure Sending Units Up to 2-5/8 Inches Long | Chromed Steel",1,9.32,14.25,2.79,https://www.amazon.com/Oemtools-25254-Oil-Pressure-Switch-Socket-12-Drive-Fits-1-Inch-And-1-116-In/dp/B000CMDPC6?tag=dcaft-20,https://www.ebay.com/itm/266677366929
Rexco Partall Paste #2 Mold Release Wax -12 oz can,1,20.22,25.6,1.54,https://www.amazon.com/Rexco-Partall-Paste-Mold-Release/dp/B0BQCZ8C3K?tag=dcaft-20,https://www.ebay.com/itm/355363169775
"Marvelity 3 Pcs Trampoline Spring Pull Tool Kit, Trampoline Parts T-Hook Puller, Trampoline Accessories Spring Pull T-Shape Hook",1,5.99,8.81,1.5,https://www.amazon.com/Marvelity-Trampoline-Spring-Accessories-T-Shape/dp/B09128Y7JH?tag=dcaft-20,https://www.ebay.com/itm/175954166795
"GSI Outdoors 74340 Pivot Tongs Orange, 8 inch",1,10.75,13.62,0.83,https://www.amazon.com/Gsi-Outdoors-Pivot-Tongs/dp/B004LF6SRY?tag=dcaft-20,https://www.ebay.com/itm/155873122344
5 Kit 3 Pin Way Car Waterproof Electrical Connector Plug Male Female Wire Cable Connector Plug with Wire AWG Marine,1,11.99,19.03,4.19,https://www.amazon.com/Qook-5-Kit-3-Pin-Way-Car-Waterproof-Electrical-Connector-Plug-Male-Female-Wire-C/dp/B075LKSQJR?tag=dcaft-20,https://www.ebay.com/itm/364642749944
Bike Safety Flag USA Flag 6 Foot Heavy Duty Fiberglass Pole Polyester Full Color Tear-Resistant Waterproof Flag Orange Safety Flag Bicycle Flag and American Flag,1,9.62,12.75,1.22,https://www.amazon.com/Bike-Safety-Flagusa-Flag-Six-Foot-Heavy-Duty-Fiberglass-Pole-Polyester-Full-Col/dp/B06XNNB4GM?tag=dcaft-20,https://www.ebay.com/itm/315142444927
Drive-up Golf Cart GCOR Accelerator Input Sensor for Club Car Precedent 2004-2009 Gas Models OEM 103327701 102528601,1,63.78,78.99,3.36,https://www.amazon.com/Golf-Cart-Gcor-Accelerator-Input-Sensor-For-Club-Car-Precedent-2004-2009-Gas-Mod/dp/B0BJV3DZ86?tag=dcaft-20,https://www.ebay.com/itm/305355421730
"New England Coffee Hazelnut Crème Medium-Roast Ground Coffee, 22-Ounce Bag, Sweet & Nutty Flavor",1,13.36,19.64,3.33,https://www.amazon.com/New-England-Coffee-Hazelnut-Creme-Medium-Roast-Ground-Coffee-22-Ounce-Bag-Swee/dp/B008VSYKCC?tag=dcaft-20,https://www.ebay.com/itm/176181864574
"Color Scents - Medium Trash Bags, Twist Tie - 8 Gallon Trash Bags, 40 Count - Laundry & Office Trash Bag, Scented Garbage Bag, Cream Bag in Vanilla Flower Scent (1 Pack of 40 Count)",1,3.94,5.76,0.96,https://www.amazon.com/dp/B09RTTPSSQ?tag=dcaft-20,https://www.ebay.com/itm/355208203685
"Old World Christmas Ornaments: Dog Collection Glass Blown Ornaments for Christmas Tree, Pembroke Welsh",1,12.91,16.55,1.16,https://www.amazon.com/Old-World-Christmas-Ornaments-Dog-Collection-Glass-Blown-Ornaments-For-Christma/dp/B004OWQ7G6?tag=dcaft-20,https://www.ebay.com/itm/256384599956
Pup Corn Plus - Puffed Dog Treats with Prebiotics and Probiotics - Chicken and Cheddar Cheese (4oz) - Made in USA,1,8.09,10.79,1.08,https://www.amazon.com/dp/B089MCFRHQ?tag=dcaft-20,https://www.ebay.com/itm/156002261679
"FolkArt Glow-in-the-Dark Acrylic Paint, 2 oz., Red",1,3.25,7.99,3.54,https://www.amazon.com/Folkart-Glow-In-The-Dark-Acrylic-Paint-2-Oz-Red/dp/B085M3W8TL?tag=dcaft-20,https://www.ebay.com/itm/364582381210
AQUANEAT 3 Pack Aquarium Bio Sponge Filter Breeding Fry Betta Shrimp Nano Fish Tank (Small up to 10Gal),1,6.43,9.5,1.65,https://www.amazon.com/Aquaneat-3-Pack-Aquarium-Bio-Sponge-Filter-Breeding-Fry-Betta-Shrimp-Nano-Fish-T/dp/B078HDL21V?tag=dcaft-20,https://www.ebay.com/itm/395209462624
5 Qty. 3.6x10mm 5A Fast Blow Fuse FA 5 Amp 250v Mini Micro,1,4.87,7.51,1.51,https://www.amazon.com/5-Qty-36X10Mm-5A-Fast-Blow-Fuse-Fa-5-Amp-250V-Mini-Micro/dp/B004TRY2HM?tag=dcaft-20,https://www.ebay.com/itm/225870451171
"Rust-Oleum 7592838 Professional High Performance Enamel Spray Paint, 15 Oz, Gloss White",1,10.79,14.08,1.18,https://www.amazon.com/Rust-Oleum-7592838-Professional-High-Performance-Enamel-Spray-Paint-15-Oz-Glos/dp/B00106EDPQ?tag=dcaft-20,https://www.ebay.com/itm/134828573734
BOOM BOOM BALLOON Spinmaster Games Refills Game,1,8.51,11.46,1.23,https://www.amazon.com/Boom-Boom-Balloon-Spinmaster-Games-Refills-Game/dp/B00HQK0MW8?tag=dcaft-20,https://www.ebay.com/itm/394987505390
"50 Sheets Carbon Paper Black Graphite Paper Transfer Tracing Paper and 5 Pieces Ball Embossing Styluses for Wood, Paper, Canvas and Other Art Craft Surfaces, 8.3 by 11.8 Inch",1,5.35,7.5,1.03,https://www.amazon.com/50-Sheets-Carbon-Paper-Black-Graphite-Paper-Transfer-Tracing-Paper-And-5-Pieces/dp/B09TK53ZF3?tag=dcaft-20,https://www.ebay.com/itm/355354407409
RC Remote Controlled AUX on/Off Electronic Switch Relay for Car Truck Boat LED Light Drone (8A),3,27.21,38.43,5.46,https://www.amazon.com/dp/B08FLVGTXQ?tag=dcaft-20,https://www.ebay.com/itm/204634162544
"(4xPCS) Straight Blade Plug, Male Female Replacement Plug,3-Wire Male Extension Cord Replacement Electrical Plugs End, 15 Amp 125 Volt,Black",2,19.28,28.88,5.26,https://www.amazon.com/Straight-Female-Replacement-Extension-Electrical/dp/B08QRGL9T8?tag=dcaft-20,https://www.ebay.com/itm/296165652040
"Rollator seat Cushion,Replacement seat for rollator Walker, Padded Seat with Brackets W/Pocket,14"" *12.8"" .Rollator Universal Replacement Parts.(1Ea Black)",1,28.9,39.75,4.89,https://www.amazon.com/dp/B0BZJPB616?tag=dcaft-20,https://www.ebay.com/itm/355304041339
3pcs Black Fast Feed Ceramic Blades Replacement Blades for Oster Fast Feed Clipper A5 Grooming Clippers Movable Blade,1,10.58,13.92,1.25,https://www.amazon.com/dp/B095RK96VG?tag=dcaft-20,https://www.ebay.com/itm/315124978337
"Quick & Clean [6-Pack] Keurig Cleaning Pods - K Cup Cleaner Pod For Keurig - 2.0 Coffee Machine Compatible, Removes Stains, Non-Toxic and Eco-Friendly",1,10.76,13.99,1.13,https://www.amazon.com/Quick-Clean-6-Pack-Keurig-Cleaning-Pods-K-Cup-Cleaner-Pod-For-Keurig-20/dp/B074CK3QSH?tag=dcaft-20,https://www.ebay.com/itm/315138490377
Pure Country,1,12.07,17.99,3.22,https://www.amazon.com/Pure-Country-Blu-ray-George-Strait/dp/B07T5WBN7Z?tag=dcaft-20,https://www.ebay.com/itm/225920834140
Gas Patio Heater Anti Tilt Tip Over Switch Fits for Patio and Room Heater Garden Outdoor (Anti Tilt FD4 Dump Switch),1,9.62,13.4,1.77,https://www.amazon.com/Gas-Patio-Heater-Anti-Tilt-Tip-Over-Switch-Fits-For-Patio-And-Room-Heater-Garden/dp/B08CY5HS5C?tag=dcaft-20,https://www.ebay.com/itm/315095286564
"Atkinson Wrapped Bulk Candy Bars, Peanut Butter, 1 Pound",1,8.7,11.87,1.39,https://www.amazon.com/Atkinson-Wrapped-Bulk-Candy-Bars-Peanut-Butter-1-Pound/dp/B01IF4OHZ6?tag=dcaft-20,https://www.ebay.com/itm/395010617051
Motorcraft FL-820-S Oil Filter,1,3.97,6.2,1.3,https://www.amazon.com/Motorcraft-FL-820-S-Oil-Filter/dp/B000AS3D3S?tag=dcaft-20,https://www.ebay.com/itm/355286965986
US Merchant Thermocouple 2304885 Dyna Glo 40-150K btu LP 1130/1474 by Fixitshop,1,8.9,12.43,1.67,https://www.amazon.com/Us-Merchant-Thermocouple-2304885-Dyna-Glo-40-150K-Btu-Lp-11301474-By-Fixitshop/dp/B01LZ1VB1F?tag=dcaft-20,https://www.ebay.com/itm/176175601572
"Timely Cetirizine HCl 10 Mg 365 Tablets - Compared to the active ingredient in Zytec Tablets – 24 Hour Allergy Relief from Sneezing, Runny Nose, Itchy Watery Eyes, Itchy Throat or Nose",1,10.37,14.78,2.19,https://www.amazon.com/Time-Cap-Labs-Inc-Timely-Cetirizine-Hcl-10-Mg-365Ct-Fast-Reliable-Allergy/dp/B09TTSV41Q?tag=dcaft-20,https://www.ebay.com/itm/315082910495
"Ozeri ZP-30GL Frying Pan Lid, 12"", Clear",1,12.75,18.99,3.39,https://www.amazon.com/12-Earth-Frying-Pan-Lid-In-Tempered-Glass-By-Ozeri/dp/B006QCNJG8?tag=dcaft-20,https://www.ebay.com/itm/225992083464
SEMKONT 1-1/4 Rolling Papers Pre Rolled Cones | 72 Pack | Natural Pre Rolled Rolling Paper with Tips | Easy to Use and Convenient,1,8.27,11.75,1.72,https://www.amazon.com/Semkont-1-14-Rolling-Papers-Pre-Rolled-Cones-72-Pack-Natural-Pre-Rolled-Rol/dp/B09YGJS28M?tag=dcaft-20,https://www.ebay.com/itm/305322553136
Once upon a Time in Hollywood,1,5.33,7.35,0.92,https://www.amazon.com/Once-upon-Hollywood-Leonardo-DiCaprio/dp/B07TNVXKMX?tag=dcaft-20,https://www.ebay.com/itm/126330285907
