Product Name,Quantity,Retail Price,Received,Profit,Amazon Link,Ebay Link
"Danco 1-1/4-Inch Rubber Drain Stopper, White, Carded, 80225",3,7.77,13.56,3.75,https://www.amazon.com/Danco-1-14-Inch-Rubber-Drain-Stopper-White-Carded-80225/dp/B000JFK0GK?tag=dcaft-20,https://www.ebay.com/itm/404207609996
"Rit Purpose Liquid Dye, 8 Oz, Royal Blue",1,3.61,5.35,0.94,https://www.amazon.com/dp/B00AQ72LF4?tag=dcaft-20,https://www.ebay.com/itm/404807796460
Heinz Tomato Ketchup (14 oz Bottle),2,4.18,7.76,2.42,https://www.amazon.com/Heinz-Tomato-Ketchup-14-Oz-Bottle/dp/B0005YKO8E?tag=dcaft-20,https://www.ebay.com/itm/355354346746
"MG217 Dandruff 3% Coal Tar Dandruff Shampoo, Controls Flaking & Relieves Itchy Scalp - 8 oz Tube",1,8.47,10.99,0.87,https://www.amazon.com/dp/B09V1ZP4Z1?tag=dcaft-20,https://www.ebay.com/itm/305352957137
072-0023RP Extended Tank Drain Assembly,1,5.35,7.63,1.14,https://www.amazon.com/Powermate-Vx-072-0023Rp-Extended-Tank-Drain-Assembly/dp/B00QQL2BPY?tag=dcaft-20,https://www.ebay.com/itm/296213340351
"Rust-Oleum 248904 Automotive High Heat Spray Paint, 12 Ounce (Pack of 1), Flat Aluminum",1,12.76,16.68,1.42,https://www.amazon.com/Rust-Oleum-248904-Automotive-High-Heat-Spray-Paint-12-Ounce-Pack-Of-1-Flat-A/dp/B003CT4AKM?tag=dcaft-20,https://www.ebay.com/itm/296073871555
"Dan-O's Seasoning Small 5 Bottle Combo | Original, Spicy, Chipotle, Crunchy & Cheesoning | 5 Pack",1,35.49,47.59,4.96,https://www.amazon.com/dp/B0C6VL4J6L?tag=dcaft-20,https://www.ebay.com/itm/355305665573
"6 Pieces Big Eye Beading Needles with Needle Bottle (2.2 inch, 3 inch)",1,4.76,6.86,1.07,https://www.amazon.com/dp/B07TZ86QKZ?tag=dcaft-20,https://www.ebay.com/itm/305332008453
"Neorexon Liquid-Tight Conduit and Connector Kit 1/2inch 25ft, Flexible Non Metallic Liquid Tight Electrical Conduit UL Certification, Electrical Conduit Kit with 5 Straight, 5 Angle Fittings",1,24.99,31.99,2.2,https://www.amazon.com/Neorexon-Liquid-Tight-Conduit-And-Connector-Kit-12Inch-25Ft-Flexible-Non-Metal/dp/B0BJKD7KNP?tag=dcaft-20,https://www.ebay.com/itm/305345374524
IRWIN Tools T-Handle 1/4-Inch Capacity Tap Wrench (12001),1,6.45,8.75,0.99,https://www.amazon.com/Irwin-Tools-T-Handle-14-Inch-Capacity-Tap-Wrench-12001/dp/B00004YOB0?tag=dcaft-20,https://www.ebay.com/itm/315115570491
"Crosman CSLT Metal Spinning Target,Black",1,12.36,17,2.09,https://www.amazon.com/Crosman-Cslt-Metal-Spinning-Targetblack/dp/B01786GBM4?tag=dcaft-20,https://www.ebay.com/itm/186302994850
How High,1,19.67,27.81,3.97,https://www.amazon.com/How-High-Blu-Ray/dp/B08Z2JWR1Y?tag=dcaft-20,https://www.ebay.com/itm/335251203632
"RiceSelect Couscous, Moroccan-Style Non-GMO Wheat Couscous Pasta, 26.5-Ounce Jar, (Pack of 1)",2,13.96,18.94,2.14,https://www.amazon.com/RiceSelect-Original-Couscous-Moroccan-Non-GMO/dp/B01IRD2VYE?tag=dcaft-20,https://www.ebay.com/itm/314724989304
"Sun-Maid California Sun-Dried Raisins - 13 oz Resealable Canister - Dried Fruit Snack for Lunches, Snacks, and Natural Sweeteners",2,9.8,14.16,2.24,https://www.amazon.com/Sun-Maid-Natural-California-Raisins-Oz/dp/B00A3NC8YK?tag=dcaft-20,https://www.ebay.com/itm/155865579129
"Zatarain's Cajun Injector Fat Free Creole Butter Recipe Injectable Marinade with Injector, 16 fl oz",1,4.39,7.15,1.69,https://www.amazon.com/Zatarains-Cajun-Injector-Fat-Free-Creole-Butter-Recipe-Injectable-Marinade-With/dp/B076D8V1SZ?tag=dcaft-20,https://www.ebay.com/itm/395175051713
"TUMS Extra Strength Assorted Berries Antacid Tablets for Heartburn Relief, 96 count",1,5.39,8.93,2.2,https://www.amazon.com/TUMS-Strength-Antacid-Supplement-Assorted-Berries-96/dp/B0014D3MGG?tag=dcaft-20,https://www.ebay.com/itm/395158201165
"Queen Helene Cocoa Butter Hand & Body Lotion, 32 Oz (Packaging May Vary)",1,4.22,5.99,0.87,https://www.amazon.com/dp/B000EGOG46?tag=dcaft-20,https://www.ebay.com/itm/394925279898
"Palmolive Ultra Strength Liquid Dish Soap, Original Green, 20 Fluid Ounce(Packaging May Vary)",1,2.87,5.99,2.22,https://www.amazon.com/Palmolive-Ultra-Strength-Liquid-Dish-Soap-Original-Green-20-Fluid-Ounce/dp/B01MY4S0DP?tag=dcaft-20,https://www.ebay.com/itm/285519300957
4PCS Fuel Cap Filler Gas Door Rubber Stop Bumper Stopper for Chevrolet Silverado Colorado Suburban Tahoe S10 GMC Sierra Yukon XL 1500 2500 3500 HD Cadillac Escalade Replace 15283098 15711102 15768697,1,5.45,7.63,1.04,https://www.amazon.com/4Pcs-Fuel-Cap-Filler-Gas-Door-Rubber-Stop-Bumper-Stopper-For-Chevrolet-Silverado/dp/B0BDVCV1VB?tag=dcaft-20,https://www.ebay.com/itm/395051767093
"YYCRAFT Stiff Felt Sheets Thick Felt 9 Inch X 12 Inch - 15 Pcs Pack, White",1,14.83,21.75,3.66,https://www.amazon.com/Yycraft-Stiff-Felt-Sheets-Thick-Felt-9-Inch-X-12-Inch-15-Pcs-Pack-White/dp/B08YDP9Q67?tag=dcaft-20,https://www.ebay.com/itm/145433692925
"Alka-Seltzer Tablet For Heartburn, Lemon Lime, 36 Count (Pack of 1)",1,6.33,8.98,1.3,https://www.amazon.com/Alka-Seltzer-Lemon-Lime-36-Count/dp/B01N40T33K?tag=dcaft-20,https://www.ebay.com/itm/225911350663
Silicone Gun And Reel Cloth,1,4,6.18,1.25,https://www.amazon.com/Silicone-Gun-And-Reel-Cloth/dp/B00GYAOURO?tag=dcaft-20,https://www.ebay.com/itm/355470428729
"Nerds Gummy Clusters Candy, Rainbow, Game Day Candy, Football Watch Party Essentials, Resealable 8 Ounce Bag",1,3.22,5.03,1.06,https://www.amazon.com/Nerds-Gummy-Clusters-8-oz/dp/B08LGD7WRZ?tag=dcaft-20,https://www.ebay.com/itm/145589807561
"Drive-up Name Plate for Club Car DS Emblem Black Gold for Golf Cart-18"" X 2.24""",1,18.61,23.98,1.77,https://www.amazon.com/Drive-Up-Name-Plate-For-Club-Car-Ds-Emblem-Black-Gold-For-Golf-Cart-18-X-224/dp/B09GM2S3BP?tag=dcaft-20,https://www.ebay.com/itm/355140401620
BRAVO COMPANY USA Gunfighter QD (Quick Detach) Heavy Duty Sling Swivel Flush Plunger Black,1,14.82,19.23,1.53,https://www.amazon.com/dp/B08428VJNG?tag=dcaft-20,https://www.ebay.com/itm/296223242713
MTM 50 Round Slip-Top Handgun Ammo Box 44/45 Cal (Clear Red),2,8.96,13.5,2.52,https://www.amazon.com/MTM-Round-Slip-Top-Handgun-Clear/dp/B001OPT8EO?tag=dcaft-20,https://www.ebay.com/itm/225954028225
"Bounty Essentials Select-A-Size Paper Towels, White, 2 Double Rolls = 4 Regular Rolls",2,7.46,11.04,1.92,https://www.amazon.com/Bounty-Essentials-Select-A-Size-Paper-Towels-White-2-Double-Rolls-4-Regular/dp/B0CDZBH85H?tag=dcaft-20,https://www.ebay.com/itm/404784926460
BRIX Jarkey Jar Opener - The Easiest Way to open a Jar,1,8.41,11.7,1.54,https://www.amazon.com/dp/B0001IX6PW?tag=dcaft-20,https://www.ebay.com/itm/404729769987
Bomeek KSG / KS7 Recoil Pad & Grip Storage Plug for Kel-Tec KSG / KS7,1,19.34,23.99,1.05,https://www.amazon.com/Bomeek-Ksg-Ks7-Recoil-Pad-Grip-Storage-Plug-For-Kel-Tec-Ksg-Ks7/dp/B0C8JDQ9D3?tag=dcaft-20,https://www.ebay.com/itm/395203493172
The Addams Family/Addams Family Values 2 Movie Collection,1,5.36,7.99,1.43,https://www.amazon.com/dp/B07TNVX78V?tag=dcaft-20,https://www.ebay.com/itm/225979156441
"Vagisil Odor Block Deodorant Powder for Women, Helps to Prevents Chafing, Talc-Free, 8 Ounce (Pack of 1)",2,6.96,11.28,2.62,https://www.amazon.com/Vagisil-Deodorant-Powder-Talc-Free-8-Ounce/dp/B000RTDUOW?tag=dcaft-20,https://www.ebay.com/itm/404126119012
"SUNLPH 50 Pack 6x4x1 Inches Small Shipping Boxes, White Corrugated Cardboard Boxes, Moving Mailing Packing Box",1,23.8,29.63,1.39,https://www.amazon.com/Sunlph-50-Pack-6X4X1-Inches-Small-Shipping-Boxes-White-Corrugated-Cardboard-Box/dp/B0B75VF9QL?tag=dcaft-20,https://www.ebay.com/itm/315154668825
Red Dust,1,9.33,12.99,1.71,https://www.amazon.com/Red-Dust/dp/B009RNK10K?tag=dcaft-20,https://www.ebay.com/itm/225967042516
"Premium Multi-Purpose Under The Cabinet, Wall Mount, and Under Counter Paper Towel Holder for Kitchen, Bathroom - Black",1,8.77,11.99,1.42,https://www.amazon.com/dp/B0BPMN4ZN2?tag=dcaft-20,https://www.ebay.com/itm/305352957096
Basswood Sheets Unfinished Plywood for Crafts - 5 PCS 1/16 x 8 x 12Inch Thin Wood Sheet for Craft DIY,1,8.5,11.16,0.99,https://www.amazon.com/dp/B08VN3HXDT?tag=dcaft-20,https://www.ebay.com/itm/126313670231
"Blue Diamond Almonds, Snack Nut Flavored Chile n' Lime perfect for On-the Go, and Snacking, 6 Ounce Can",1,4.11,6.03,1.02,https://www.amazon.com/dp/B0CLFNN2PM?tag=dcaft-20,https://www.ebay.com/itm/126328105775
"50 Sheets Carbon Paper Black Graphite Paper Transfer Tracing Paper and 5 Pieces Ball Embossing Styluses for Wood, Paper, Canvas and Other Art Craft Surfaces, 8.3 by 11.8 Inch",1,5.23,7.5,1.15,https://www.amazon.com/50-Sheets-Carbon-Paper-Black-Graphite-Paper-Transfer-Tracing-Paper-And-5-Pieces/dp/B09TK53ZF3?tag=dcaft-20,https://www.ebay.com/itm/355354407409
"G8 Led Bulb Dimmable Under Microwave Light Bulb 50W Halogen Replacement for GE Samsung LG Over The Range Microwave Hood, 120V 5W 500LM Daylight White 6000K, Replaces WB08X10057 WB08X10051, 2-Pack",1,10.62,14.99,2.12,https://www.amazon.com/dp/B0B7HDGXFD?tag=dcaft-20,https://www.ebay.com/itm/225989450689
"Maybelline Total Temptation Eyebrow Definer Pencil, Soft Brown, 1 Count",1,9.73,12.54,0.93,https://www.amazon.com/Maybelline-Temptation-Eyebrow-Definer-Pencil/dp/B074VD4X7W?tag=dcaft-20,https://www.ebay.com/itm/355145853125
"4 Pack Flag Pole Rings, Upgrade Stainless Steel Flag Pole Clips, Flag Clips with Carabiner for 0.7-1.2 Inch Diameter Flagpole, Flagpole Rings for Outside House, Vehicle, Yacht, Boat Flag Pole",1,5.32,7.21,0.81,https://www.amazon.com/dp/B0CDQ99JLR?tag=dcaft-20,https://www.ebay.com/itm/305345374066
"Oral-B EssentialFloss Cavity Defense Dental Floss, 50 M, 2 Pack",2,9.76,13.4,1.64,https://www.amazon.com/Oral-B-EssentialFloss-Cavity-Defense-Dental/dp/B074F5NNCP?tag=dcaft-20,https://www.ebay.com/itm/355431178656
"VETRISCIENCE Canine Plus MultiVitamin for Senior Dogs - Vet Recommended Vitamin Supplement - Supports Mood, Skin, Coat, Liver Function, 60 Chews (Packaging May Vary)",1,12.5,15.96,1.07,https://www.amazon.com/dp/B071R3FM21?tag=dcaft-20,https://www.ebay.com/itm/355349539511
"UNIGT 150pcs Push Mount Cable Zip Tie with Car Wire Loom Routing Clips, Universal Compatible with GM Ford Trucks Cars Sedan UTV Engine Bay Self Locking Straps",1,18.01,23.99,2.38,https://www.amazon.com/Unigt-150Pcs-Push-Mount-Cable-Zip-Tie-With-Car-Wire-Loom-Routing-Clips-Universa/dp/B0BZRW78ZR?tag=dcaft-20,https://www.ebay.com/itm/285595667693
Konideke 7 Inch T5 22W Circular Bulb Compatible with Floxite Zadro Rialto Makeup Magnifying Vanity Mirror FC22 Round Fluorescent Light Bulb 6500K 2 Count,1,18.6,23.16,1.09,https://www.amazon.com/Konideke-725-Inch-T5-22W-Circular-Fluorescent-Light-Bulb-6400K-Fc22-Round-Lamp/dp/B0BJL85XFR?tag=dcaft-20,https://www.ebay.com/itm/395199762467
"6 Pieces Microwave Oven Door Switch Replacement Part W10269458 W10727360 W10269460 SZM-V16-FC-61 SZM-V16-FC-62 SZM-V16-FC-63, Compatible with Most Microwave Ovens",1,9.99,14.75,2.55,https://www.amazon.com/6-Pieces-Microwave-Oven-Door-Switch-Replacement-Part-W10269458-W10727360-W102694/dp/B08NF3DY22?tag=dcaft-20,https://www.ebay.com/itm/225870416377
Mediasonic Remote Control for HW-150PVR / HW-150PVR-Y22 Model,1,10.59,15.28,2.4,https://www.amazon.com/Mediasonic-Remote-Control-HW-150PVR-Model/dp/B07QR7YBYG?tag=dcaft-20,https://www.ebay.com/itm/145511041352
"Cascade Power Dry Dishwasher Rinse Aid, 16 fl oz",1,7.19,10.95,2.12,https://www.amazon.com/Cascade-Power-Dry-Dishwasher-Rinse-Aid-16-Fl-Oz/dp/B00LV5EJTG?tag=dcaft-20,https://www.ebay.com/itm/355420337166
Goody 8 Claw Clips Pinces Hebillas Model #76023,1,6.65,10.04,1.88,https://www.amazon.com/Goody-Clips-Pinces-Hebillas-Model/dp/B001707RQM?tag=dcaft-20,https://www.ebay.com/itm/404757493397
"LeYi for Samsung Galaxy A03s Phone Case: Galaxy AO3s Phone Case with Slide Camera Cover + [2 Packs] Screen Protector, 360 Full Body Military-Grade Phone Case with Kickstand for A03s, Black",1,10.64,14.99,2.1,https://www.amazon.com/dp/B09SP2MKD3?tag=dcaft-20,https://www.ebay.com/itm/225945174306
"ZUEXT 11"" x 50"" Clear Skateboard Grip Tape, Waterproof Scooter Griptape, Longboard Grip Tape, Anti Slip Bubble Free Transparent Griptape for Rollerboard Stairs Pedal Wheelchair Step (125x27cm)",1,11.99,16.69,2.2,https://www.amazon.com/Zuext-11-X-50-Clear-Skateboard-Grip-Tape-Waterproof-Scooter-Griptape-Longboa/dp/B0755WR3XR?tag=dcaft-20,https://www.ebay.com/itm/296037199378
"50 Sheets Carbon Paper Black Graphite Paper Transfer Tracing Paper and 5 Pieces Ball Embossing Styluses for Wood, Paper, Canvas and Other Art Craft Surfaces, 8.3 by 11.8 Inch",1,5.22,7.5,1.16,https://www.amazon.com/50-Sheets-Carbon-Paper-Black-Graphite-Paper-Transfer-Tracing-Paper-And-5-Pieces/dp/B09TK53ZF3?tag=dcaft-20,https://www.ebay.com/itm/355354407409
The Three Lives of Thomasina,1,9.69,14.89,2.97,https://www.amazon.com/The-Three-Lives-Of-Thomasina/dp/B0001I55R4?tag=dcaft-20,https://www.ebay.com/itm/176231478756
Lowrance HDS-12 Live SUNCOVER,1,40.31,49.42,1.7,https://www.amazon.com/Lowrance-Hds-12-Live-Suncover/dp/B07MGJ2RHL?tag=dcaft-20,https://www.ebay.com/itm/355367299041
Rated R,1,12.68,16.68,1.5,https://www.amazon.com/dp/B0CH3Y1Q3B?tag=dcaft-20,https://www.ebay.com/itm/395076415753
"4 Oz Food Grade Grease for kitchen Aid Stand Mixer - by Huthbrother, Universally for kitchen Stand Mixer, Mixer Gear Attachments, Include Gasket 9709511 4162324 With Spatula, NSF-H1 Accredited.",1,11.99,16.99,2.45,https://www.amazon.com/dp/B08FZHF7JX?tag=dcaft-20,https://www.ebay.com/itm/404738564718
"Maybelline New York Expert Wear Twin Brow and Eye Pencils, 104 Light Brown, 2 Count",2,11.76,16.1,1.92,https://www.amazon.com/dp/B01N12F4D5?tag=dcaft-20,https://www.ebay.com/itm/315096271101
"ARCTIC MX-4 (4 g) - Premium Performance Thermal Paste for All Processors (CPU, GPU - PC, PS4, Xbox), Very high Thermal Conductivity, Long Durability, Safe Application, Non-Conductive, CPU Thermal",1,5.38,12.55,5.29,https://www.amazon.com/Arctic-Mx-4-4-G-Premium-Performance-Thermal-Paste-For-All-Processors-Cpu-G/dp/B07L9BDY3T?tag=dcaft-20,https://www.ebay.com/itm/364605008618
"Wahl USA Dry Skin & Itch Relief Pet Shampoo for Dogs – Oatmeal Formula with Coconut Lime Verbena & Pet Friendly Formula, 24 Oz - Model 820004A",1,9.73,12.78,1.13,https://www.amazon.com/Wahl-Dog-Pet-Shampoo-Oatmeal/dp/B005CUTWDE?tag=dcaft-20,https://www.ebay.com/itm/355415954035
2PCS BAY15D 1157 LED Light Bulb Socket Holder with Wire Connector for Car Auto Truck,1,7.37,10.91,1.9,https://www.amazon.com/BAY15D-Light-Socket-Holder-Connector/dp/B07WSP7FXC?tag=dcaft-20,https://www.ebay.com/itm/355221374401
"Pentel® Hi-Polymer Lead Refills, 0.5 mm, HB Hardness, Tube of 30 Refills",1,1.7,3.21,1.03,https://www.amazon.com/Pentel-Hi-Polymer-Lead-Refills-05-Mm-Hb-Hardness-Tube-Of-30-Refills/dp/B000R32P9O?tag=dcaft-20,https://www.ebay.com/itm/296192648606
"Chef Craft Basic Nylon Meat Cooking Fork, 12 inch, Black",1,4.29,6.02,0.83,https://www.amazon.com/Chef-Craft-Basic-Nylon-Cooking/dp/B00BZ2BK1A?tag=dcaft-20,https://www.ebay.com/itm/315057565719
"Houdini Leak-Free Discreet Flask, Black 7.25 ounces",1,5.17,7.38,1.1,https://www.amazon.com/Houdini-Leak-Free-Discreet-Flask-Black-725-Ounces/dp/B091G7MWJF?tag=dcaft-20,https://www.ebay.com/itm/355408683660
"K & S Precision Metals 8125 3PK 1/16x.014 BRS RND Tube, 1/16""x .014""",2,8.48,15.38,4.6,https://www.amazon.com/K-S-Precision-Metals-8125-3Pk-116X014-Brs-Rnd-Tube-116X-014/dp/B000BPIL9Q?tag=dcaft-20,https://www.ebay.com/itm/266681141449
"June Gold 440 Pieces, 0.7 mm 4B Lead Refills, 110 Pieces Per Dispenser, Medium Thickness, Break Resistant Lead/Graphite (Pack of 4 Dispensers)",1,6.45,8.69,0.94,https://www.amazon.com/June-Gold-440-Pieces-07-Mm-4B-Lead-Refills-110-Pieces-Per-Tube-Medium-Thickn/dp/B08SZQC5ML?tag=dcaft-20,https://www.ebay.com/itm/355147439573
"40 Watt Appliance Light Bulb,High Temp Resistance Microwave Oven Bulb, E17 Indicator Intermediate Base T8 Tubular Incandescent Light Bulbs,Dimmable (Pack of 8)",1,8.69,11.37,0.97,https://www.amazon.com/40-Watt-Appliance-Light-Bulbhigh-Temp-Resistance-Microwave-Oven-Bulb-E17-Indic/dp/B088JRMKMV?tag=dcaft-20,https://www.ebay.com/itm/355422394000
JVC Memory Foam Earbud Marshmallow Memory Foam Earbud with Mic Black (HAFX38MB),1,9.91,13.99,1.98,https://www.amazon.com/Jvc-Memory-Foam-Earbud-Marshmallow-Memory-Foam-Earbud-With-Mic-Black-Hafx38Mb/dp/B072DZLFMP?tag=dcaft-20,https://www.ebay.com/itm/145454142595
"The Spice Lab Curing Salt #1 (1 Lb Bag) Pink Curing Salt (Prague Powder 1) 6.25% Sodium Nitrite Curing Salt for Meat, Game, Bacon Cure, Brining Salt, Jerky Cure, Brisket & Corned Beef - Made in USA",1,9.99,13.84,1.77,https://www.amazon.com/dp/B075ZBGVWG?tag=dcaft-20,https://www.ebay.com/itm/355189006509
12 PCS Soda Can Lids Reusable Bottle Fizz Lid Caps Can Covers for Beer Carbonated Drinks and Other Canned Beverages (Colourful),1,10.06,13.16,1.13,https://www.amazon.com/dp/B085ZZGNTC?tag=dcaft-20,https://www.ebay.com/itm/314843681173
"French's Original Chili-O Seasoning Mix, 1.75 oz",2,3.24,5.72,1.62,https://www.amazon.com/dp/B078B26PZV?tag=dcaft-20,https://www.ebay.com/itm/126207605956
"ARCAN TOOLS Suction Gun Transparent Body and Ribbed Nozzle, 16 OZ Chamber Capacity (ASTSG)",1,11.46,15.41,1.64,https://www.amazon.com/Arcan-Professional-Tools-Suction-Gun-Transparent-Body-And-Ribbed-Nozzle-16-Oz-C/dp/B07Z1CN3R5?tag=dcaft-20,https://www.ebay.com/itm/355325292430
"Adams Sales Order Book, 3-Part Carbonless, White/Canary/Pink, 5-9/16"" x 8-7/16"", 50 Sets (TC5805)",1,4.87,7.35,1.38,https://www.amazon.com/Adams-Sales-Order-Book-3-Part-Carbonless-Whitecanarypink-5-916-X-8-716/dp/B000GAUK0Y?tag=dcaft-20,https://www.ebay.com/itm/404095661687
"100 - 12 x 15"" Poly Clear Plastic T-Shirt / Apparel Bags 1 Mil 2"" Back Flap Lock",1,10.81,14.99,1.93,https://www.amazon.com/100-12-X-15-Poly-Clear-Plastic-T-Shirt-Apparel-Bags-1-Mil-2-Back-Flap-Lock/dp/B01J07MKJC?tag=dcaft-20,https://www.ebay.com/itm/305375041347
"Hoof Trimming Shears for Sheep Goat Hoof Trimmers Multi-Purpose Carbon Steel Pruning Shears for Used by Farmers, Florists and Home Gardeners",1,15.47,25.4,6.12,https://www.amazon.com/Hoof-Trimming-Shears-For-Sheep-Goat-Hoof-Trimmers-Multi-Purpose-Carbon-Steel-Pru/dp/B07JJZQCYL?tag=dcaft-20,https://www.ebay.com/itm/404807796991
Motorcraft FL-820-S Oil Filter,1,4.3,6.2,0.97,https://www.amazon.com/Motorcraft-FL-820-S-Oil-Filter/dp/B000AS3D3S?tag=dcaft-20,https://www.ebay.com/itm/355286965986
Work Sharp Knife & Tool Sharpener 6000 Grit Fine Replacement Belt Kit WSSA0002705,1,13.95,19,2.2,https://www.amazon.com/Work-Sharp-Knife-Tool-Sharpener-6000-Grit-Fine-Replacement-Belt-Kit-Wssa000270/dp/B008BX95DG?tag=dcaft-20,https://www.ebay.com/itm/225933013942
Two Mules For Sister Sara,1,5.25,7.63,1.24,https://www.amazon.com/Two-Mules-For-Sister-Sara/dp/B00008CMT4?tag=dcaft-20,https://www.ebay.com/itm/355240580180
"INVISALIGN Cleaning Crystals for Clear Aligners and Retainers, (50 Packets)",1,41.87,52.34,2.62,https://www.amazon.com/Invisalign-Cleaning-Crystals-For-Clear-Aligners-And-Retainers-50-Packets/dp/B07HCQ8LKV?tag=dcaft-20,https://www.ebay.com/itm/225972332915
The Three Lives of Thomasina,1,10.44,13.72,1.22,https://www.amazon.com/The-Three-Lives-Of-Thomasina/dp/B0001I55R4?tag=dcaft-20,https://www.ebay.com/itm/296093207163
"Duck Brand Stretch Wrap Roll, Clear, 5 inches by 1000 feet, 1 Pack, White (285849)",1,11.99,17.87,3.2,https://www.amazon.com/dp/B0793GSD39?tag=dcaft-20,https://www.ebay.com/itm/176103006798
"L'Oreal Paris Revitalift Triple Power Anti-Aging Face Moisturizer, 0.5 oz - Reduces Wrinkles, Brightens, Hydrates, Smoothes Skin",1,9.18,12.12,1.12,https://www.amazon.com/Loreal-Paris-Revitalift-Triple-Power-Anti-Aging-Face-Moisturizer-Pro-Retinol/dp/B07193HP6L?tag=dcaft-20,https://www.ebay.com/itm/395166809563
"Pain 100% - Organic Hot Sauce - 7.5oz Bottle - 250,000-1,000,000 Scovilles - Made in Kansas, USA. Made with Habanero Peppers - 100% Natural Ingredients",1,12.29,18.75,3.65,https://www.amazon.com/PAIN-100%25-Hot-Sauce-7-5/dp/B00UN02IEI?tag=dcaft-20,https://www.ebay.com/itm/285672677816
"Bag Balm Skin Moisturizer with Lanolin for Chapped Lips, Dry Skin and More | 4oz Tin",1,9.35,13.96,2.52,https://www.amazon.com/Vermonts-Original-Bag-Balm-Moisturizer/dp/B01AASJCPA?tag=dcaft-20,https://www.ebay.com/itm/404721007715
"Graded Card Protectors for Shipping - 4 x 6 Waterproof Rigid Card Sleeves for Mailing Inserts, Hard Plastic Cardboard Sheets, 100 Pack",1,11.06,14.99,1.68,https://www.amazon.com/Trading-Card-Protectors-For-Shipping-35-X-45-Waterproof-Rigid-Hard-Plastic-M/dp/B0CH2YC9MN?tag=dcaft-20,https://www.ebay.com/itm/225984980681
"1/4 Inch Shelf Pegs,40Pcs Bracket Support Pins L-Shaped Holders for Cabinets,Shelves ,Wodrob,Nickel Plated",1,6.28,8.75,1.16,https://www.amazon.com/Bracket-Support-L-Shaped-Holders-Cabinets/dp/B0BVLRDR9N?tag=dcaft-20,https://www.ebay.com/itm/315055670554
"Casio HS-8VA, Solar Powered Standard Function Calculator",1,3.81,5.71,1.04,https://www.amazon.com/Casio-HS8VA-Standard-Function-Calculator/dp/B001GXM68Y?tag=dcaft-20,https://www.ebay.com/itm/404788588947
JSER Type C USB-C Female Input to DC Power PD Charge Cable fit for Laptop 18-20V (4.0x1.3mm)…,1,7.88,12.55,2.79,https://www.amazon.com/Female-4-53-0mm-Charge-Laptop-18-20V/dp/B083323P3Z?tag=dcaft-20,https://www.ebay.com/itm/355264021616
"PetArmor Ear Mite Treatment for Dogs, Ear Mite Medicine Kills Ticks and Ear Mites to Relieve Itchiness, Sooths Ears with Aloe, 3oz",2,10.92,15.98,2.66,https://www.amazon.com/Petarmor-Ear-Mite-And-Tick-Treatment-For-Dogs-3-Oz/dp/B00SCEVVR2?tag=dcaft-20,https://www.ebay.com/itm/305353061115
Sneezy the Snowman,1,5.84,8.28,1.2,https://www.amazon.com/Sneezy-The-Snowman/dp/1477810544?tag=dcaft-20,https://www.ebay.com/itm/355276344203
"Gardner Bender CR-100 4-Inch Romex Cable Ripper, Metallic",2,4.3,7.38,1.98,https://www.amazon.com/Gardner-Bender-Cr-100-4-Inch-Romex-Cable-Ripper/dp/B000BQUCIS?tag=dcaft-20,https://www.ebay.com/itm/315167136181
"1/4 Inch Shelf Pegs,40Pcs Bracket Support Pins L-Shaped Holders for Cabinets,Shelves ,Wodrob,Nickel Plated",1,6.28,8.75,1.16,https://www.amazon.com/Bracket-Support-L-Shaped-Holders-Cabinets/dp/B0BVLRDR9N?tag=dcaft-20,https://www.ebay.com/itm/315055670554
"Performore 40 Pack Z Table Top Fasteners with Screws, Heavy Duty Z Table Top Fasteners Solid Steel with Black Screws",1,9.97,14.67,2.5,https://www.amazon.com/Table-Fasteners-Screws-Heavy-Solid/dp/B08C2MDLNB?tag=dcaft-20,https://www.ebay.com/itm/355374259462
THE COMPLETE KITCHEN AID COOKBOOK: The Stand Mixer Cookbook with 100 Deliciously Simple Homemade Recipes,1,16.04,22.93,3.45,https://www.amazon.com/The-Complete-Kitchen-Aid-Cookbook-The-Stand-Mixer-Cookbook-With-100-Deliciously/dp/B09NRBTZ18?tag=dcaft-20,https://www.ebay.com/itm/364263149343
Thompson's Punjana Irish Breakfast 80 teabags (8.82oz) x 1 pack,1,9,12.65,1.75,https://www.amazon.com/Thompsons-Punjana-Irish-Breakfast-80-Teabags-882Oz-X-1-Pack/dp/B001SB4QKU?tag=dcaft-20,https://www.ebay.com/itm/315085262069
"MTM 50 Round Flip-Top Rifle Ammo Box 220 Swift 243 308 Win, Green",2,10.58,15.86,2.9,https://www.amazon.com/Mtm-50-Round-Flip-Top-Rifle-Ammo-Box-220-Swift-243-308-Win/dp/B0010FNUH4?tag=dcaft-20,https://www.ebay.com/itm/404712060403
"McCormick Garlic Pepper Seasoning Grinder, 1.23 oz",3,8.64,18.24,6.87,https://www.amazon.com/Mccormick-Garlic-Pepper-Seasoning-Grinder-123-Oz/dp/B000V89GGA?tag=dcaft-20,https://www.ebay.com/itm/176224670542
Bro Glo Self Tanner for The Boys - Quick Application Foam Mousse - Easy Sunless Tan For Your Face - Oil Free Water Based for Faster Skin Drying - Natural Sun Kissed Bronze Color Perfect for Men - Beach and Pool Not Required 3.4 FL oz,1,27.06,34.12,1.94,https://www.amazon.com/Bro-Glo-Self-Tanner-Boys/dp/B0BKZ2MTKL?tag=dcaft-20,https://www.ebay.com/itm/355364350881
"CRAFTSMAN Deep Socket, SAE, 1/4-Inch Drive, 9/16-Inch, 6-Point (CMMT43587)",1,6.4,8.74,1.03,https://www.amazon.com/Craftsman-Deep-Socket-Sae-14-Inch-Drive-916-Inch-6-Point-Cmmt43587/dp/B07QLV4Z2M?tag=dcaft-20,https://www.ebay.com/itm/315098463292
Adkins Western Style Barbecue BBQ Seasoning 16 OZ All Natural,2,27.8,35.5,2.38,https://www.amazon.com/Adkins-Western-Style-Barbecue-Bbq-Seasoning-16-Oz-All-Natural/dp/B014G6YYHI?tag=dcaft-20,https://www.ebay.com/itm/225917049118
"Scott ComfortPlus Toilet Paper, 12 Double Rolls, 231 Sheets per Roll, Septic-Safe, 1-Ply Toilet Tissue",1,6.88,9.52,1.21,https://www.amazon.com/dp/B07BGLT25K?tag=dcaft-20,https://www.ebay.com/itm/355153519481
"00119 KILLEM BIOCIDE 16 OZ. BOTTLE, TREATS 1920 GALLONS OF DIESEL FUEL PER BOTTLE",1,26.67,37.29,5.03,https://www.amazon.com/Fppf-00119-Killem-Biocide-16-Oz-Bottle-Treats-1920-Gallons-Of-Diesel-Fuel-Per/dp/B009LMW96G?tag=dcaft-20,https://www.ebay.com/itm/305377583409
"Replacement Filter Cap, Compatible with AeroPress® Coffee and Espresso Maker",1,4.99,7.89,1.72,https://www.amazon.com/South-Street-Designs-Replacement-Filter-Cap-Compatible-With-Aeropress-Coffee-A/dp/B00M1X9852?tag=dcaft-20,https://www.ebay.com/itm/156007757212
Death in Paradise: Season Twelve,1,21.54,27.05,1.45,https://www.amazon.com/dp/B0BSR2M6VX?tag=dcaft-20,https://www.ebay.com/itm/296203788398
"FRAM PH10575 Spin-On Oil Filter, Extra Guard.",2,9.5,13.18,1.7,https://www.amazon.com/Fram-Ph10575-Spin-On-Oil-Filter-Extra-Guard/dp/B003YNYCIG?tag=dcaft-20,https://www.ebay.com/itm/126319257415
Bluedio HT Turbine Wireless Bluetooth 5.0 Stereo Headphones with Mic (White),1,31.79,43.63,5.3,https://www.amazon.com/Bluedio-Ht-Turbine-Wireless-Bluetooth-50-Stereo-Headphones-With-Mic-White/dp/B07ZYYVXBW?tag=dcaft-20,https://www.ebay.com/itm/176185954438
"JILINWEI 8 Pcs Mounting Feet for Milwaukee Packout,Mounting Plate Feet Mount Adapter Compatible with Milwaukee Packout System,Black",2,32.4,46.32,6.98,https://www.amazon.com/Jilinwei-8-Pcs-Mounting-Feet-For-Milwaukee-Packoutmounting-Plate-Feet-Mount-Ada/dp/B09V11VMFF?tag=dcaft-20,https://www.ebay.com/itm/364724988745
"Nature's Way Herbal Neem Leaf, Traditional Ayurvedic Intestinal Remedy*, 100 Vegan Capsules",1,8.27,11.88,1.83,https://www.amazon.com/Natures-Way-Herbal-Neem-Leaf-Traditional-Ayurvedic-Intestinal-Remedy-100-Veg/dp/B000293X4E?tag=dcaft-20,https://www.ebay.com/itm/296211654959
